{
  "$schema": "https://json-schema.org/draft/2020-12/schema",
  "$id": "https://verichron.local/contracts/evidence-sidecar.schema.json",
  "title": "EvidenceSidecar",
  "description": "Written by the processor next to each backup's canonical manifest (EPOCH-401). content_root is the evidence identity that EPOCH-402 keys evidence_items on. Zod mirror: ts/evidenceSidecar.ts.",
  "type": "object",
  "additionalProperties": false,
  "required": [
    "schema_version",
    "evidence_name",
    "algorithm",
    "content_root",
    "manifest_path",
    "file_count",
    "total_bytes",
    "source_path",
    "hashed_at",
    "tool"
  ],
  "properties": {
    "schema_version": { "const": 1 },
    "evidence_name": {
      "type": "string",
      "minLength": 1,
      "description": "Backup directory name as discovered by the processor."
    },
    "algorithm": { "const": "sha256" },
    "content_root": {
      "type": "string",
      "pattern": "^[0-9a-f]{64}$",
      "description": "sha256 of the exact canonical manifest bytes. Verify with: sha256sum <manifest_path>."
    },
    "manifest_path": {
      "type": "string",
      "minLength": 1,
      "description": "Content-addressed manifest location relative to the workspace, '/'-separated: evidence/<evidence_name>/manifests/<content_root>.sha256."
    },
    "file_count": { "type": "integer", "minimum": 0 },
    "total_bytes": { "type": "integer", "minimum": 0 },
    "source_path": {
      "type": "string",
      "minLength": 1,
      "description": "Absolute path of the hashed backup at hashing time. Informational: identity is content_root, not location."
    },
    "hashed_at": { "type": "string", "format": "date-time" },
    "tool": {
      "type": "object",
      "additionalProperties": false,
      "required": ["name", "version"],
      "properties": {
        "name": { "type": "string", "minLength": 1 },
        "version": { "type": "string", "minLength": 1 }
      }
    }
  }
}
